区域,城市,年份,文件类型,支出类别,匹配关键词,原文片段,金额（万元）,页码,文件名
东部,北京,2025,财政预算报告,physical,未明确方向,"市级政府性基金预算支出完成1013.4亿元,其中:地方财力安排的支出733.8亿元,完成调整预算的",10134000.0,,北京市2025政府工作报告.txt
东部,北京,2025,财政预算报告,physical,未明确方向,中央专项转移支付安排支出279.6亿元,2796000.0,,北京市2025政府工作报告.txt
东部,北京,2025,财政预算报告,physical,未明确方向,15.7亿元、专项债务转贷支出1748.6亿元、地方政府专项债务还,17486000.0,,北京市2025政府工作报告.txt
东部,北京,2025,财政预算报告,physical,未明确方向,"本等支出190.2亿元、政策性结转下年使用48.9亿元,总支出",1902000.0,,北京市2025政府工作报告.txt
东部,北京,2025,财政预算报告,physical,未明确方向,"金21.3亿元、结转下年使用10.3亿元,总支出84.0亿元",840000.0,,北京市2025政府工作报告.txt
东部,北京,2025,财政预算报告,physical,未明确方向,"营预算支出完成43.1亿元,完成预算的100.0%,主要用于引导",431000.0,,北京市2025政府工作报告.txt
东部,北京,2025,财政预算报告,physical,未明确方向,分配区0.9亿元、向一般公共预算调出资金18.5亿元、结转下年,185000.0,,北京市2025政府工作报告.txt
东部,北京,2025,财政预算报告,physical,未明确方向,"使用7.2亿元,总支出69.7亿元",697000.0,,北京市2025政府工作报告.txt
东部,北京,2025,财政预算报告,physical,未明确方向,"社会保险基金预算支出完成4637.4亿元,完成",46374000.0,,北京市2025政府工作报告.txt
东部,北京,2025,财政预算报告,physical,未明确方向,"超长期特别国债等各类中央支持资金2083亿元,进一步提升政府",20830000.0,,北京市2025政府工作报告.txt
东部,北京,2025,财政预算报告,physical,未明确方向,"理新机制,通过政府资金先投快投,带动社会投资286亿元,支持",2860000.0,,北京市2025政府工作报告.txt
东部,北京,2025,财政预算报告,physical,未明确方向,"目线上免费提供电子采购文件,节约企业资金成本近5000万元,",5000.0,,北京市2025政府工作报告.txt
东部,北京,2025,财政预算报告,physical,未明确方向,"评价,优化分配资金12.3亿元",123000.0,,北京市2025政府工作报告.txt
东部,北京,2025,财政预算报告,physical,未明确方向,"项目,涉及资金544.0亿元,代表人次、项目数量、资金规模分别增",5440000.0,,北京市2025政府工作报告.txt
东部,北京,2025,财政预算报告,physical,未明确方向,"列入年初预算,全市一般公共预算支出预计8404.0亿元,比上年",84040000.0,,北京市2025政府工作报告.txt
东部,北京,2025,财政预算报告,physical,未明确方向,"使用等支出947.9亿元,总支出9351.9亿元",9479000.0,,北京市2025政府工作报告.txt
东部,北京,2025,财政预算报告,physical,未明确方向,府性基金预算调入2.8亿元、国有资本经营预算调入20.8亿元、,28000.0,,北京市2025政府工作报告.txt
东部,北京,2025,财政预算报告,physical,未明确方向,"算支出5510.9亿元,比上年年初预算数增长4.7%,比上年执行",55109000.0,,北京市2025政府工作报告.txt
东部,北京,2025,财政预算报告,physical,未明确方向,"力安排的经费类支出4513.1亿元,增长5.7%",45131000.0,,北京市2025政府工作报告.txt
东部,北京,2025,财政预算报告,physical,未明确方向,"基建类支出586.0亿元,增长24.7%",5860000.0,,北京市2025政府工作报告.txt
东部,北京,2025,财政预算报告,physical,未明确方向,支付提前下达支出411.8亿元,4118000.0,,北京市2025政府工作报告.txt
东部,北京,2025,财政预算报告,physical,未明确方向,加上解中央支出122.1亿元、地,1221000.0,,北京市2025政府工作报告.txt
东部,北京,2025,财政预算报告,physical,未明确方向,"方政府债券转贷支出245.9亿元、地方政府债券还本等164.8亿元,总支出6043.7亿元",2459000.0,,北京市2025政府工作报告.txt
东部,北京,2025,财政预算报告,physical,未明确方向,"出预算安排6.4亿元,下降0.9%,主要是认真执行中央八项规定",64000.0,,北京市2025政府工作报告.txt
东部,北京,2025,财政预算报告,physical,未明确方向,"2025年,市对区体制返还和转移支付预算安排2138.8亿元,",21388000.0,,北京市2025政府工作报告.txt
东部,北京,2025,财政预算报告,physical,未明确方向,"模等措施,安排市政府固定资产投资820.0亿元,其中:一般公共",8200000.0,,北京市2025政府工作报告.txt
东部,北京,2025,财政预算报告,physical,未明确方向,"预算安排586.0亿元(含新增一般债券70.0亿元),政府性基金预",5860000.0,,北京市2025政府工作报告.txt
东部,北京,2025,财政预算报告,physical,未明确方向,算安排234.0亿元,2340000.0,,北京市2025政府工作报告.txt
东部,北京,2025,财政预算报告,physical,未明确方向,"前,经市政府同意,提前下达市政府固定资产投资100.0亿元,其",1000000.0,,北京市2025政府工作报告.txt
东部,北京,2025,财政预算报告,physical,未明确方向,"中:市级部门预算83.3亿元,市对区转移支付16.7亿元",833000.0,,北京市2025政府工作报告.txt
东部,北京,2025,财政预算报告,physical,未明确方向,"级预算部门正常履职等必要性支出258.1亿元,其中:市级一般公",2581000.0,,北京市2025政府工作报告.txt
东部,北京,2025,财政预算报告,physical,未明确方向,"共预算支出257.3亿元,市级政府性基金预算支出0.8亿元",2573000.0,,北京市2025政府工作报告.txt
东部,北京,2025,财政预算报告,human,教育支出,教育支出安排518.6亿元,5186000.0,,北京市2025政府工作报告.txt
东部,北京,2025,财政预算报告,physical,未明确方向,科学技术支出安排484.3亿元,4843000.0,,北京市2025政府工作报告.txt
东部,北京,2025,财政预算报告,physical,未明确方向,"类支出438.1亿元,增长3.0%,包括市本级435.1亿元、市对区",4381000.0,,北京市2025政府工作报告.txt
东部,北京,2025,财政预算报告,human,文化旅游体育与传媒,文化旅游体育与传媒支出安排154.0亿元,1540000.0,,北京市2025政府工作报告.txt
东部,北京,2025,财政预算报告,physical,未明确方向,"安排的经费类支出139.7亿元,增长2.0%,包括市本级110.1亿元、市对区转移支付29.6亿元",1397000.0,,北京市2025政府工作报告.txt
东部,北京,2025,财政预算报告,human,社会保障和就业,社会保障和就业支出安排450.5亿元,4505000.0,,北京市2025政府工作报告.txt
东部,北京,2025,财政预算报告,physical,未明确方向,"的经费类支出239.8亿元,增长2.1%,包括市本级198.4亿元、",2398000.0,,北京市2025政府工作报告.txt
东部,北京,2025,财政预算报告,human,卫生健康,卫生健康支出安排299.8亿元,2998000.0,,北京市2025政府工作报告.txt
东部,北京,2025,财政预算报告,physical,未明确方向,"类支出233.8亿元,增长2.8%,包括市本级215.0亿元、市对区",2338000.0,,北京市2025政府工作报告.txt
东部,北京,2025,财政预算报告,physical,未明确方向,节能环保支出安排148.9亿元,1489000.0,,北京市2025政府工作报告.txt
东部,北京,2025,财政预算报告,physical,未明确方向,"类支出133.0亿元,增长1.8%,包括市本级92.9亿元、市对区转",1330000.0,,北京市2025政府工作报告.txt
东部,北京,2025,财政预算报告,physical,未明确方向,城乡社区支出安排385.9亿元,3859000.0,,北京市2025政府工作报告.txt
东部,北京,2025,财政预算报告,physical,未明确方向,"类支出240.9亿元,增长1.4%,包括市本级226.3亿元、市对区",2409000.0,,北京市2025政府工作报告.txt
东部,北京,2025,财政预算报告,human,农林水,农林水支出安排256.7亿元,2567000.0,,北京市2025政府工作报告.txt
东部,北京,2025,财政预算报告,physical,未明确方向,"支出216.8亿元,增长2.0%,包括市本级106.5亿元、市对区转",2168000.0,,北京市2025政府工作报告.txt
东部,北京,2025,财政预算报告,physical,交通运输,交通运输支出安排325.8亿元,3258000.0,,北京市2025政府工作报告.txt
东部,北京,2025,财政预算报告,physical,未明确方向,"类支出306.2亿元,增长2.6%,包括市本级305.8亿元、市对区",3062000.0,,北京市2025政府工作报告.txt
东部,北京,2025,财政预算报告,physical,未明确方向,商业服务业等支出安排17.5亿元,175000.0,,北京市2025政府工作报告.txt
东部,北京,2025,财政预算报告,physical,未明确方向,"费类支出(市本级支出)14.9亿元,增长2.6%",149000.0,,北京市2025政府工作报告.txt
东部,北京,2025,财政预算报告,physical,未明确方向,住房保障支出安排35.6亿元,356000.0,,北京市2025政府工作报告.txt
东部,北京,2025,财政预算报告,physical,未明确方向,"支出(市本级支出)35.5亿元,增长189.2%",355000.0,,北京市2025政府工作报告.txt
东部,北京,2025,财政预算报告,physical,城市更新,城市更新支出安排82.4亿元,824000.0,,北京市2025政府工作报告.txt
东部,北京,2025,财政预算报告,physical,未明确方向,"支出(市对区转移支付)81.2亿元,增长2.5%",812000.0,,北京市2025政府工作报告.txt
东部,北京,2025,财政预算报告,physical,未明确方向,灾害防治及应急管理支出安排49.8亿元,498000.0,,北京市2025政府工作报告.txt
东部,北京,2025,财政预算报告,physical,未明确方向,"排的经费类支出19.1亿元,增长16.8%,包括市本级17.8亿元、",191000.0,,北京市2025政府工作报告.txt
东部,北京,2025,财政预算报告,physical,未明确方向,"援助其他地区支出安排55.0亿元,全部为地方财力安排的经",550000.0,,北京市2025政府工作报告.txt
东部,北京,2025,财政预算报告,physical,未明确方向,"结转下年使用等支出2112.3亿元,总支出4611.8亿元",21123000.0,,北京市2025政府工作报告.txt
东部,北京,2025,财政预算报告,physical,未明确方向,"729.3亿元,其中:地方财力安排的经费类支出461.4亿元,比上年",4614000.0,,北京市2025政府工作报告.txt
东部,北京,2025,财政预算报告,physical,未明确方向,"支出234.0亿元,下降6.4%",2340000.0,,北京市2025政府工作报告.txt
东部,北京,2025,财政预算报告,physical,未明确方向,中央专项转移支付安排支出33.9亿元,339000.0,,北京市2025政府工作报告.txt
东部,北京,2025,财政预算报告,physical,未明确方向,金2.8亿元、再融资专项债务转贷支出1426.3亿元、新增地方政府,14263000.0,,北京市2025政府工作报告.txt
东部,北京,2025,财政预算报告,physical,未明确方向,债务转贷支出506.9亿元、专项债务还本5.6亿元、再融资专项债,5069000.0,,北京市2025政府工作报告.txt
东部,北京,2025,财政预算报告,physical,未明确方向,"全市国有资本经营预算支出56.3亿元,增",563000.0,,北京市2025政府工作报告.txt
东部,北京,2025,财政预算报告,physical,未明确方向,"加向一般公共预算调出资金23.1亿元,总支出79.4亿元",231000.0,,北京市2025政府工作报告.txt
东部,北京,2025,财政预算报告,physical,未明确方向,"市级国有资本经营预算支出48.4亿元,增",484000.0,,北京市2025政府工作报告.txt
东部,北京,2025,财政预算报告,physical,未明确方向,"专项转移支付分配各区支出0.9亿元,向一般公共预算调出资金",9000.0,,北京市2025政府工作报告.txt
东部,北京,2025,财政预算报告,physical,未明确方向,"20.8亿元,总支出70.1亿元",701000.0,,北京市2025政府工作报告.txt
东部,北京,2025,财政预算报告,physical,未明确方向,"社会保险基金预算支出5017.2亿元,增长8.2%,",50172000.0,,北京市2025政府工作报告.txt
东部,广州,2021,财政决算报告,physical,未明确方向,①，以及动用预算稳定调节基金109.2亿元后，市级,1092000.0,,广州市2025年预算.txt
东部,广州,2021,财政决算报告,physical,未明确方向,区级支出764.7亿元，上解省级支出264亿元，安排预算稳定调节,7647000.0,,广州市2025年预算.txt
东部,广州,2021,财政决算报告,physical,未明确方向,基金170.4亿元，债务转贷及还本支出95.5亿元后，市级一般公,955000.0,,广州市2025年预算.txt
东部,广州,2021,财政决算报告,physical,未明确方向,收支相抵，2021年市级一般公共预算资金年终结转12.3亿元，,123000.0,,广州市2025年预算.txt
东部,广州,2021,财政决算报告,physical,未明确方向,①调入资金包括年初预算从政府性基金调入171.3亿元、国有资本经营预算调入33.2亿元、其他资,1713000.0,,广州市2025年预算.txt
东部,广州,2021,财政决算报告,physical,未明确方向,标资金124.2亿元，省内扶贫上解资金也有所增长,1242000.0,,广州市2025年预算.txt
东部,广州,2021,财政决算报告,physical,未明确方向,调入资金213.7亿元，增长4.4%,2137000.0,,广州市2025年预算.txt
东部,广州,2021,财政决算报告,physical,未明确方向,动用预算稳定调节基金109.2亿元，增长66.8%，,1092000.0,,广州市2025年预算.txt
东部,广州,2021,财政决算报告,physical,未明确方向,"支出1,035.2亿元，补助各区支出764.7亿元，上解省级以及安排",7647000.0,,广州市2025年预算.txt
东部,广州,2021,财政决算报告,physical,未明确方向,预算稳定调节基金等支出529.9亿元,5299000.0,,广州市2025年预算.txt
东部,广州,2021,财政决算报告,physical,未明确方向,其中：一般公共服务支出88.1亿元，下降8.7%，,881000.0,,广州市2025年预算.txt
东部,广州,2021,财政决算报告,physical,未明确方向,公共安全支出77亿元，下降,770000.0,,广州市2025年预算.txt
东部,广州,2021,财政决算报告,human,教育支出,教育支出153.9亿元，增长11.3%，主要是加大,1539000.0,,广州市2025年预算.txt
东部,广州,2021,财政决算报告,physical,未明确方向,科学技术支出73.9亿元，下降17.5%，主,739000.0,,广州市2025年预算.txt
东部,广州,2021,财政决算报告,human,文化旅游体育与传媒,文化旅游体育与传媒支出27.4亿元，下降8.9%，主要是广,274000.0,,广州市2025年预算.txt
东部,广州,2021,财政决算报告,human,社会保障和就业,社会保障和就业支出155.5亿元，增长4.7%,1555000.0,,广州市2025年预算.txt
东部,广州,2021,财政决算报告,human,卫生健康,卫生健康支出131.3亿元，基本持平,1313000.0,,广州市2025年预算.txt
东部,广州,2021,财政决算报告,physical,未明确方向,节能环保支出33.8亿元，增长68%，主要原因：,338000.0,,广州市2025年预算.txt
东部,广州,2021,财政决算报告,physical,未明确方向,城乡社区支出53.1亿元，下降12.6%，主要是由于科目调整，部分年中上级追加转移支,531000.0,,广州市2025年预算.txt
东部,广州,2021,财政决算报告,human,农林水,农林水支出15亿元，下降,150000.0,,广州市2025年预算.txt
东部,广州,2021,财政决算报告,physical,交通运输,交通运输支出29亿元，增长10.2%，主要是年中上级追加,290000.0,,广州市2025年预算.txt
东部,广州,2021,财政决算报告,physical,未明确方向,商业服务业等支出13.2亿元，增长,132000.0,,广州市2025年预算.txt
东部,广州,2021,财政决算报告,physical,未明确方向,金融支出11.2亿元，增长195.1%，主,112000.0,,广州市2025年预算.txt
东部,广州,2021,财政决算报告,physical,未明确方向,援助其他地区支出11.6亿元，基本持平,116000.0,,广州市2025年预算.txt
东部,广州,2021,财政决算报告,physical,未明确方向,自然资源海洋气象等支出4.8亿元，基本持平,48000.0,,广州市2025年预算.txt
东部,广州,2021,财政决算报告,physical,未明确方向,住房保障支出78.7亿元，基本持平,787000.0,,广州市2025年预算.txt
东部,广州,2021,财政决算报告,physical,粮油物资储备,粮油物资储备支出7亿元，增长21.6%，主要是,70000.0,,广州市2025年预算.txt
东部,广州,2021,财政决算报告,physical,未明确方向,灾害防治及应急管理支出5亿元,50000.0,,广州市2025年预算.txt
东部,广州,2021,财政决算报告,physical,未明确方向,其他支出14.1亿元,141000.0,,广州市2025年预算.txt
东部,广州,2021,财政决算报告,physical,未明确方向,债务付息支出及债务发行费用支出24亿元，基本持平,240000.0,,广州市2025年预算.txt
东部,广州,2021,财政决算报告,physical,未明确方向,2.补助区级支出764.7亿元，增长13.4%,7647000.0,,广州市2025年预算.txt
东部,广州,2021,财政决算报告,physical,未明确方向,3.上解省以及安排预算稳定调节基金等支出529.9亿元，增长,5299000.0,,广州市2025年预算.txt
东部,广州,2021,财政决算报告,physical,未明确方向,府债券转贷及债务还本支出95.5亿元，下降12.1%，主要是市本,955000.0,,广州市2025年预算.txt
东部,广州,2021,财政决算报告,physical,未明确方向,公”经费一般公共预算支出合计1.9亿元，比年初预算下降22.3%,19000.0,,广州市2025年预算.txt
东部,广州,2021,财政决算报告,physical,未明确方向,严格按照预备费使用范围安排支出5.5亿元，执行率为50%，剩余5.5亿元按规定补充预算稳定调节基,55000.0,,广州市2025年预算.txt
东部,广州,2021,财政决算报告,physical,未明确方向,2020年结转至2021年安排的部门项目支出6.2亿元，当年实,62000.0,,广州市2025年预算.txt
东部,广州,2021,财政决算报告,physical,未明确方向,际支出5.6亿元，剔除省级应回收资金、结转到下年度使用的省补,56000.0,,广州市2025年预算.txt
东部,广州,2021,财政决算报告,physical,未明确方向,预算稳定调节基金余额180.8亿元，2022年年初预算根据需要动,1808000.0,,广州市2025年预算.txt
东部,广州,2021,财政决算报告,physical,未明确方向,2021年，市本级政府性基金支出907.4亿元，加上债务还本,9074000.0,,广州市2025年预算.txt
东部,广州,2021,财政决算报告,physical,未明确方向,"及转贷支出594.7亿元，补助区级支出158.9亿元，调出资金171.3亿元后，市级政府性基金总支出1,832.3亿元",5947000.0,,广州市2025年预算.txt
东部,广州,2021,财政决算报告,physical,未明确方向,2021年市本级政府性基金支出907.4亿元，增长16.5%，完成,9074000.0,,广州市2025年预算.txt
东部,广州,2021,财政决算报告,physical,未明确方向,其中：国有土地使用权出让金支出540.7亿元，增长32.9%,5407000.0,,广州市2025年预算.txt
东部,广州,2021,财政决算报告,physical,未明确方向,城市基础设施配套费支出12.2亿元,122000.0,,广州市2025年预算.txt
东部,广州,2021,财政决算报告,physical,未明确方向,车辆通行费支出2.4亿元,24000.0,,广州市2025年预算.txt
东部,广州,2021,财政决算报告,physical,未明确方向,彩票公益金支出3.5亿元,35000.0,,广州市2025年预算.txt
东部,广州,2021,财政决算报告,physical,未明确方向,地方政府专项债务付息支出49.1亿元,491000.0,,广州市2025年预算.txt
东部,广州,2021,财政决算报告,physical,未明确方向,其他支出10.9亿元,109000.0,,广州市2025年预算.txt
东部,广州,2021,财政决算报告,physical,未明确方向,2021年市本级国有资本经营预算支出27.8亿元，下降18.6%，,278000.0,,广州市2025年预算.txt
东部,广州,2021,财政决算报告,physical,未明确方向,用于：一是国有企业资本金注入11.8亿元，支持公益性设施建设、,118000.0,,广州市2025年预算.txt
东部,广州,2021,财政决算报告,physical,未明确方向,历史遗留问题及改革成本支出9.8亿元,98000.0,,广州市2025年预算.txt
东部,广州,2021,财政决算报告,physical,未明确方向,及其他支出6.2亿元,62000.0,,广州市2025年预算.txt
东部,广州,2021,财政决算报告,physical,未明确方向,区级0.4亿元后，市级国有资本经营预算总支出61.4亿元,614000.0,,广州市2025年预算.txt
东部,广州,2021,财政决算报告,physical,未明确方向,2021年全市社会保险基金总支出829.9亿元，增长13.2%，完,8299000.0,,广州市2025年预算.txt
东部,广州,2021,财政决算报告,human,失业,1.失业保险基金支出46.8亿元，下降30%,468000.0,,广州市2025年预算.txt
东部,广州,2021,财政决算报告,human,医疗,2.职工社会医疗保险基金支出542.8亿元，增长22%,5428000.0,,广州市2025年预算.txt
东部,广州,2021,财政决算报告,human,养老,3.城乡居民基本养老保险基金支出57.4亿元，下降0.3%,574000.0,,广州市2025年预算.txt
东部,广州,2021,财政决算报告,human,医疗,4.城乡居民基本医疗保险基金支出47.8亿元，增长23.5%,478000.0,,广州市2025年预算.txt
东部,广州,2021,财政决算报告,human,养老,5.机关事业单位基本养老保险基金支出135.1亿元，增长,1351000.0,,广州市2025年预算.txt
东部,广州,2021,财政决算报告,physical,未明确方向,增地方政府债券转贷资金282.1亿元、项目调整资金41亿元、调,2821000.0,,广州市2025年预算.txt
东部,广州,2021,财政决算报告,physical,未明确方向,年结余7.6亿元、动用预算稳定调节基金25.2亿元，经市第十五,252000.0,,广州市2025年预算.txt
东部,广州,2021,财政决算报告,physical,未明确方向,支出282.8亿元（全部为专项债券），转贷区级支出338.2亿元（一,2828000.0,,广州市2025年预算.txt
东部,广州,2021,财政决算报告,physical,未明确方向,资金282.8亿元，用于支持28个省市重大项目，其中：用于白云,2828000.0,,广州市2025年预算.txt
东部,广州,2021,财政决算报告,physical,未明确方向,截至2021年底，市本级新增债券资金282.8亿元全部拨付并实际,2828000.0,,广州市2025年预算.txt
东部,广州,2021,财政决算报告,physical,未明确方向,2021年市本级财政专户管理资金支出20.8亿元，增长13%，,208000.0,,广州市2025年预算.txt
东部,广州,2021,财政决算报告,physical,未明确方向,2021年市级财政共计投入487.4亿元推动“四个出新出彩”，,4874000.0,,广州市2025年预算.txt
东部,广州,2021,财政决算报告,physical,机场,括：投入100.1亿元提升国际航空枢纽功能，白云机场三期扩建加,1001000.0,,广州市2025年预算.txt
东部,广州,2021,财政决算报告,physical,交通,投入251.1亿元加强交通基础设,2511000.0,,广州市2025年预算.txt
东部,广州,2021,财政决算报告,human,文化,年市级财政共投入33.9亿元壮大城市文化综合实力,339000.0,,广州市2025年预算.txt
东部,广州,2021,财政决算报告,human,文化,投入5.1亿元推进公共文化事业发展，高标准完成中共三大会址、,51000.0,,广州市2025年预算.txt
东部,广州,2021,财政决算报告,human,文化,投入12.7亿元推动文化旅游产,127000.0,,广州市2025年预算.txt
东部,广州,2021,财政决算报告,human,体育,投入5.7亿元推动群众体育事业发展，打造“羊城运动,57000.0,,广州市2025年预算.txt
东部,广州,2021,财政决算报告,physical,未明确方向,市级财政共投入33.3亿元提升现代服务业水平,333000.0,,广州市2025年预算.txt
东部,广州,2021,财政决算报告,physical,未明确方向,投入7亿元提升总部经济发展能级，,70000.0,,广州市2025年预算.txt
东部,广州,2021,财政决算报告,physical,未明确方向,投入10.1亿元加快建设现代,101000.0,,广州市2025年预算.txt
东部,广州,2021,财政决算报告,physical,未明确方向,2021年市级财政共投入41.5亿元,415000.0,,广州市2025年预算.txt
东部,广州,2021,财政决算报告,human,人才,投入23.5亿元推动人才强市建设，深入实施“广聚英才,235000.0,,广州市2025年预算.txt
东部,广州,2021,财政决算报告,physical,未明确方向,投入2.5亿元持续优,25000.0,,广州市2025年预算.txt
东部,广州,2021,财政决算报告,physical,未明确方向,2021年市级财政共计投入396.2亿元推动经济高质量发展，,3962000.0,,广州市2025年预算.txt
东部,广州,2021,财政决算报告,physical,未明确方向,2021年市级财政共投入93.4亿元支持科技创新,934000.0,,广州市2025年预算.txt
东部,广州,2021,财政决算报告,physical,未明确方向,投入19.3亿元支持创新主体建设和推动创新成果转化，深,193000.0,,广州市2025年预算.txt
东部,广州,2021,财政决算报告,physical,未明确方向,投入6.1亿元营造科技创新创业,61000.0,,广州市2025年预算.txt
东部,广州,2021,财政决算报告,physical,未明确方向,主要包括：投入37亿元推进产业,370000.0,,广州市2025年预算.txt
东部,广州,2021,财政决算报告,physical,未明确方向,投入39.2亿元支持数字经济发展，获批国家人工智能创新应用先,392000.0,,广州市2025年预算.txt
东部,广州,2021,财政决算报告,physical,产业园,共投入产业园区补助资金226.6亿元,2266000.0,,广州市2025年预算.txt
东部,广州,2021,财政决算报告,physical,未明确方向,主要包括：投入142.5亿元支持南沙打造面向世界、面向未来的国家战略平台，率先打造,1425000.0,,广州市2025年预算.txt
