区域,城市,年份,文件类型,支出类别,匹配关键词,原文片段,金额（万元）,页码,文件名
东部,深圳,2022,财政决算报告,physical,未明确方向,调整后，2022年本级一般公共预算总收支规模由3596.3亿元调整为3850.7亿元，政府性基金预算总收支规模由2305.2亿元调整为2422.2亿元,35963000.0,,深圳市2025预算.txt
东部,深圳,2022,财政决算报告,physical,未明确方向,大鹏新区政府性基金预算总收支规模由22.4亿元调整为27.4亿元,224000.0,,深圳市2025预算.txt
东部,深圳,2022,财政决算报告,physical,未明确方向,深汕特别合作区政府性基金预算总收支规模由82.1亿元调整为84.1亿元,821000.0,,深圳市2025预算.txt
东部,深圳,2022,财政决算报告,physical,未明确方向,2022年全市地方政府债务限额2246亿元（包含财政部对2022年安排使用的结存限额清算调整后增加20亿元）,200000.0,,深圳市2025预算.txt
东部,深圳,2022,财政决算报告,physical,未明确方向,2022年，大鹏新区一般公共预算总收支92.9亿元，政府性基金预算总收支21.6亿元，国有资本经营预算总收支2万元,929000.0,,深圳市2025预算.txt
东部,深圳,2022,财政决算报告,physical,未明确方向,2022年，深汕特别合作区一般公共预算总收支97.7亿元，政府性基金预算总收支64.7亿元，国有资本经营预算总收支85万元,977000.0,,深圳市2025预算.txt
东部,深圳,2022,财政决算报告,physical,未明确方向,2022年，前海管理局一般公共预算总收支36.9亿元，政府性基金预算总收支27.1亿元，国有资本经营预算总收支1.6亿元,369000.0,,深圳市2025预算.txt
东部,深圳,2022,财政决算报告,human,卫生健康,二是关于扎实做好基本民生保障，2022年全市教育、卫生健康和节能环保等九大类民生支出3417.5亿元、增长7%，占财政支出的比重达68.4%，持续加大民生投入力度,34175000.0,,深圳市2025预算.txt
东部,深圳,2022,财政决算报告,physical,未明确方向,三是关于加大基础设施投资力度，2022年全市政府投资项目支出2127亿元、增长14.8%，推动扩大有效投资，有力服务和支持全市重大项目建设,21270000.0,,深圳市2025预算.txt
东部,深圳,2022,财政决算报告,physical,未明确方向,二是主动谋划加力稳住经济大盘，推动全市纾困政策“全面顶格、能出尽出”，配合推出助企纾困、稳增长等5个“30条”组合政策，投入财政资金超过480亿元，持续加大惠企助企力度，推动经济发展稳中有进、持续向好,4800000.0,,深圳市2025预算.txt
东部,深圳,2022,财政决算报告,physical,未明确方向,三是财政金融联动为市场主体注入源头活水，用好用活中小微企业银行贷款风险补偿资金池，撬动新增银行贷款4575亿元，推动融资担保扩面、分险、降费，新增再担保贷款173亿元，惠及市场主体超12万户,45750000.0,,深圳市2025预算.txt
东部,深圳,2022,财政决算报告,physical,未明确方向,全年一般公共预算支出4997.4亿元，增长9.4%，其中九大类民生支出3417.5亿元，占财政支出的比重达68.4%,49974000.0,,深圳市2025预算.txt
东部,深圳,2022,财政决算报告,physical,未明确方向,二是新增地方债早发快用，财政部下达我市地方政府债务限额718.9亿元，包括新增债务限额548亿元、结存专项债额度117亿元和再融资债券53.9亿元，及早发行完毕，再次在香港发行50亿元离岸人民币地方债，首次同时推出绿色和蓝色债券,7189000.0,,深圳市2025预算.txt
东部,深圳,2022,财政决算报告,physical,未明确方向,三是用好中央和省直达资金资源，全市收到直达资金144.8亿元、支出144.4亿元，支出进度99.8%，惠及企业8600多家、惠及群众近310万人，有力支持基层兜牢“三保”底线,1448000.0,,深圳市2025预算.txt
东部,深圳,2023,财政决算报告,physical,未明确方向,全市一般公共预算支出5012.4亿元，一般债务还本22亿元，加上安排预算稳定调节基金、上解中央和省支出以及年终结余等各项转移性支出840.4亿元，全市一般公共预算支出总计5874.8亿元，收支平衡,50124000.0,,深圳市2025预算.txt
东部,深圳,2023,财政决算报告,physical,未明确方向,2023年，全市政府性基金预算支出1369.4亿元，债务还本支出52.1亿元，加上年终结余等各项转移性支出506.7亿元，支出总计1928.2亿元，收支平衡,13694000.0,,深圳市2025预算.txt
东部,深圳,2023,财政决算报告,physical,未明确方向,2023年，全市国有资本经营预算支出67.5亿元，加上年终结余等各项转移性支出31.6亿元，支出总计99.1亿元，收支平衡,675000.0,,深圳市2025预算.txt
东部,深圳,2023,财政决算报告,physical,未明确方向,市本级一般公共预算当年支出2265.5亿元，一般债务还本支出12亿元，加上安排预算稳定调节基金、上解中央和省支出以及年终结余等转移性支出1387.3亿元，市本级一般公共预算支出总计3664.8亿元，收支平衡,22655000.0,,深圳市2025预算.txt
东部,深圳,2023,财政决算报告,physical,未明确方向,与向市七届人大五次会议报告的预计执行数相比，决算收支总计增加5.6亿元，主要是根据中央和省年终结算据实增加,56000.0,,深圳市2025预算.txt
东部,深圳,2023,财政决算报告,human,教育支出,2023年市本级一般公共预算支出总计3664.8亿元，主要包括一般公共服务支出131.7亿元，公共安全支出115.7亿元，教育支出291.9亿元，科学技术支出328.1亿元，文化旅游体育与传媒支出81.6亿元，社会保障和就业支出120.7亿元，卫生健康支出326.8亿元，节能环保支出128.0亿元，城乡社区支出99.6亿元，农林水支出56.4亿元，交通运输支出124.2亿元，资源勘探工业信息等支出184.6亿元，商业服务业等支出83.2亿元，金融支出90.2亿元，自然资源海洋气象等支出17.3亿,36648000.0,,深圳市2025预算.txt
东部,深圳,2023,财政决算报告,physical,未明确方向,以及各项转移性支出1387.2亿元，主要包括补助各区（含大鹏新区、深汕特别合作区）支出873.7亿元，上解中央支出90.1亿元，上解省支出233.5亿元，区域间转移性支出19.2亿元，债务转贷支出17亿元，补充预算周转金0元，安排预算稳定调节基金96.1亿元，⑦年终结余57.6亿元,13872000.0,,深圳市2025预算.txt
东部,深圳,2023,财政决算报告,physical,未明确方向,2023年本级预备费预算60亿元，实际支出50亿元（已列入相关支出科目决算数），剩余资金已用于补充预算稳定调节基金,600000.0,,深圳市2025预算.txt
东部,深圳,2023,财政决算报告,physical,未明确方向,2022年结转到2023年使用的市本级资金共计65.6亿元，2023年支出31.6亿元，主要用于政府投资、政府采购、专项资金等结转项目，剩余资金已统筹用于相关支出和补充预算稳定调节基金,656000.0,,深圳市2025预算.txt
东部,深圳,2023,财政决算报告,physical,未明确方向,2023年，市本级各预算单位的因公出国（境）经费支出0.25亿元，公务用车经费1.26亿元（其中购置支出0.26亿元、运行维护费支出1亿元），公务接待费支出0.19亿元，“三公”经费支出合计1.7亿元，较预算控制数少1.72亿元，其中因公出国（境）经费少0.35亿元，公务用车经费少1.14亿元（其中购置费少0.22亿元，运行维护费少0.92亿元），公务接待费少0.24亿元,2500.0,,深圳市2025预算.txt
东部,深圳,2023,财政决算报告,physical,未明确方向,2023年，市本级政府性基金预算支出500.7亿元，债务还本支出4.9亿元，以及年终结余等各项转移性支出1245.1亿元，支出总计1750.7亿元,5007000.0,,深圳市2025预算.txt
东部,深圳,2023,财政决算报告,physical,未明确方向,与向市七届人大五次会议报告的预计执行数相比，决算收支总计减少0.2亿元，主要是根据中央和省年终结算据实减少,2000.0,,深圳市2025预算.txt
东部,深圳,2023,财政决算报告,physical,未明确方向,2023年，市本级国有资本经营预算支出合计58.6亿元，加上年终结余等各项转移性支出27.6亿元（其中26.1亿元调出至一般公共预算）,586000.0,,深圳市2025预算.txt
东部,深圳,2023,财政决算报告,physical,未明确方向,支出总计86.2亿元,862000.0,,深圳市2025预算.txt
东部,深圳,2023,财政决算报告,physical,未明确方向,一是一般公共预算，全市收到中央转移支付资金570亿元、省转移支付资金25.7亿元，主要用于支持基层落实减税降费政策、稳定市场主体、保障改善民生等方面,5700000.0,,深圳市2025预算.txt
东部,深圳,2023,财政决算报告,physical,未明确方向,二是政府性基金预算，全市收到中央转移支付资金2.6亿元、省转移支付资金1.1亿元，主要用于民航事业发展、扶残助残等,26000.0,,深圳市2025预算.txt
东部,深圳,2023,财政决算报告,physical,未明确方向,三是国有资本经营预算，全市收到中央转移支付资金335万元，主要用于支持国有企业退休人员社会化管理等,335.0,,深圳市2025预算.txt
东部,深圳,2023,财政决算报告,physical,未明确方向,经市七届人大常委会第十八次会议审查批准，2023年市本级财政预算调整事项主要有：一是增加举借债务188亿元，主要是执行中财政部下达我市一般债务限额2亿元和专项债务限额186亿元,1880000.0,,深圳市2025预算.txt
东部,深圳,2023,财政决算报告,physical,未明确方向,四是前海合作区发行使用市本级下达的专项债5.1亿元，以及调增发债单位上缴的发行费付息费等0.1亿元,51000.0,,深圳市2025预算.txt
东部,深圳,2023,财政决算报告,physical,未明确方向,调整后，2023年本级一般公共预算收支总计由3446.9亿元调整为3448.9亿元，政府性基金预算收支总计由1586.7亿元调整为1772.7亿元,34469000.0,,深圳市2025预算.txt
东部,深圳,2023,财政决算报告,physical,未明确方向,大鹏新区一般公共预算收支总计由63.4亿元调整为64.4亿元,634000.0,,深圳市2025预算.txt
东部,深圳,2023,财政决算报告,physical,未明确方向,深汕特别合作区政府性基金预算收支总计由83.8亿元调整为85.8亿元,838000.0,,深圳市2025预算.txt
东部,深圳,2023,财政决算报告,physical,未明确方向,前海合作区政府性基金预算收支总计由82.4亿元调整为87.6亿元,824000.0,,深圳市2025预算.txt
东部,深圳,2023,财政决算报告,physical,未明确方向,2023年，大鹏新区一般公共预算收支总计76.2亿元，政府性基金预算收支总计38.3亿元，国有资本经营预算收支总计3万元,762000.0,,深圳市2025预算.txt
东部,深圳,2023,财政决算报告,physical,未明确方向,2023年，深汕特别合作区一般公共预算收支总计58.9亿元，政府性基金预算收支总计88亿元，国有资本经营预算收支总计0.6亿元,589000.0,,深圳市2025预算.txt
东部,深圳,2023,财政决算报告,physical,未明确方向,2023年，前海管理局一般公共预算收支总计62.7亿元，政府性基金预算收支总计37.8亿元，国有资本经营预算收支总计0.9亿元,627000.0,,深圳市2025预算.txt
东部,深圳,2023,财政决算报告,physical,未明确方向,二是关于调整优化支出结构、加大民生保障力度，2023年全市一般公共预算支出5012.4亿元，首次突破5000亿元大关,50124000.0,,深圳市2025预算.txt
东部,深圳,2023,财政决算报告,human,卫生健康,其中教育、卫生健康和节能环保等九大类民生支出3303.4亿元，占财政支出的比重达65.9%,33034000.0,,深圳市2025预算.txt
东部,深圳,2023,财政决算报告,physical,未明确方向,保持必要的支出强度，推动重点领域和项目支出提效提速，全市一般公共预算支出5012.4亿元，全市政府投资全口径完成投资2100.1亿元，及时清理失效低效财政政策，有序推进财政奖补资金免申即享、容缺审批等，政策“红利”加速释放,50124000.0,,深圳市2025预算.txt
东部,深圳,2023,财政决算报告,human,教育,全市教育、卫生等九大类民生支出3303.4亿元，占财政支出比重达到65.9%,33034000.0,,深圳市2025预算.txt
东部,深圳,2023,财政决算报告,human,教育支出,推动教育事业迈上新台阶，全市教育支出1001.4亿元、首次突破千亿元,10014000.0,,深圳市2025预算.txt
东部,深圳,2023,财政决算报告,human,卫生健康,完善高水平医疗卫生服务体系，全市卫生健康支出619.4亿元，丰富优质医疗资源供给，提升基层卫生健康服务能力，强化公立医院财政投入绩效考核应用，推动公立医院高质量发展,6194000.0,,深圳市2025预算.txt
东部,深圳,2023,财政决算报告,physical,保障性住房,大力保障住有宜居，全市住房保障支出214.4亿元，通过专项债、REITs、国企参与等多渠道建设筹集保障性住房,2144000.0,,深圳市2025预算.txt
东部,深圳,2023,财政决算报告,human,社会保障和就业,织牢织密社会保障网，全市社会保障和就业支出303.9亿元，支持提高最低生活保障标准，出台普惠托育财政补贴政策，支持劳动者提技赋能，加快养老服务体系建设,3039000.0,,深圳市2025预算.txt
东部,深圳,2024,财政预算报告,physical,未明确方向,全市一般公共预算支出5012.1亿元，加上一般债还本支出和各类转移性支出，支出总计5874.1亿元，收支平衡,50121000.0,,深圳市2025预算.txt
东部,深圳,2024,财政预算报告,physical,未明确方向,市本级一般公共预算支出2265.5亿元，加上一般债还本支出和各类转移性支出，支出总计3659.2亿元，收支平衡,22655000.0,,深圳市2025预算.txt
东部,深圳,2024,财政预算报告,physical,未明确方向,市本级政府性基金预算支出500.7亿元，加上专项债还本支出和各类转移性支出后，支出总计1751亿元，收支平衡,5007000.0,,深圳市2025预算.txt
东部,深圳,2024,财政预算报告,physical,未明确方向,市本级国有资本经营预算支出58.6亿元，加上调出至一般公共预算26.1亿元等各类转移性支出后，支出总计86.2亿元，收支平衡,586000.0,,深圳市2025预算.txt
东部,深圳,2024,财政预算报告,physical,未明确方向,坚持常态化抓支出进度，推动重点领域和项目支出提效提速，全市一般公共预算支出5012.1亿元、政府投资支出1458.9亿元，支出规模保持在合理水平,50121000.0,,深圳市2025预算.txt
东部,深圳,2024,财政预算报告,physical,未明确方向,争取中央和省直达资金226.3亿元、支出进度99.6%，惠及2.1万家企业和336.5万名群众,2263000.0,,深圳市2025预算.txt
东部,深圳,2024,财政预算报告,human,教育,全市教育、卫生等九大类民生支出3310亿元，占财政支出比重达到66%,33100000.0,,深圳市2025预算.txt
东部,深圳,2024,财政预算报告,human,教育支出,全市教育支出1001.5亿元、首次突破千亿元，构建“义务教育投入足额保障、非义务教育成本合理分担、规范鼓励支持社会力量投资办学”格局，新增基础教育学位20.7万个，新改扩建一批幼儿园和中小学,10015000.0,,深圳市2025预算.txt
东部,深圳,2024,财政预算报告,human,卫生健康,全市卫生健康支出619.1亿元，丰富优质医疗资源供给，提升基层卫生健康服务能力，强化公立医院财政投入绩效考核应用，推动公立医院高质量发展,6191000.0,,深圳市2025预算.txt
东部,深圳,2024,财政预算报告,physical,保障性住房,全市住房保障支出214.6亿元，通过专项债、REITs、国企参与等多渠道建设筹集保障性住房,2146000.0,,深圳市2025预算.txt
东部,深圳,2024,财政预算报告,human,社会保障和就业,全市社会保障和就业支出303.6亿元，支持提高最低生活保障标准，出台普惠托育财政补贴政策，支持劳动者提技赋能，加快养老服务体系建设,3036000.0,,深圳市2025预算.txt
东部,深圳,2024,财政预算报告,human,文化旅游体育与传媒,全市文化旅游体育与传媒支出127.5亿元，推动新增公共文化设施面积21万平方米、体育场地面积150万平方米，“开放共享、一键预约”体育场馆累计达1930所，全年接待游客1.7亿人次,1275000.0,,深圳市2025预算.txt
东部,深圳,2024,财政预算报告,physical,未明确方向,——全市一般公共预算支出安排超4700亿元，保持必要的支出强度,47000000.0,,深圳市2025预算.txt
东部,深圳,2024,财政预算报告,physical,未明确方向,按照收支平衡的原则，初步汇总全市一般公共预算支出4722.6亿元，加上一般债还本支出和各类转移性支出后，相应代编全市一般公共预算支出总计5459.7亿元,47226000.0,,深圳市2025预算.txt
东部,深圳,2024,财政预算报告,physical,未明确方向,按照收支平衡的原则，相应安排市本级一般公共预算支出2166.1亿元，加上一般债还本支出和各类转移性支出后，支出总计3318.7亿元,21661000.0,,深圳市2025预算.txt
东部,深圳,2024,财政预算报告,physical,未明确方向,坚持尽力而为、量力而行，全市安排九大类民生支出3152.5亿元、占财政支出比重达到66.8%，年度执行中将进一步统筹资金加大民生投入力度，兜住兜准兜牢民生底线,31525000.0,,深圳市2025预算.txt
东部,深圳,2024,财政预算报告,human,教育支出,全市安排教育支出1033.7亿元，实现“两个只增不减”，推动健全教育“四个体系”，优化教育经费投入机制，鼓励社会力量投资办学，加强高素质师资队伍建设，培养引进一批名师名校长，逐步配齐配强教研员队伍，深化教育评价改革，开展区域教育高质量发展监测试点,10337000.0,,深圳市2025预算.txt
东部,深圳,2024,财政预算报告,human,文化旅游体育与传媒,全市安排文化旅游体育与传媒支出77.4亿元，加快深圳湾文化广场、深圳歌剧院、深圳自然博物馆、深圳科技馆新馆、深圳书城湾区城等重大文化设施建设,774000.0,,深圳市2025预算.txt
东部,深圳,2024,财政预算报告,human,卫生健康,全市安排卫生健康支出440.9亿元，深化卫生健康领域财政投入改革，协同推进公共卫生服务体系、医疗服务体系、医疗保障体系、药品供应保障体系“四个体系”建设，促进医疗、医保、医药、医教协调联动，全力补短板、提质量、促均衡，探索完善基本医疗服务补助等公立医院投入机制，推动医疗卫生事业高质量发展,4409000.0,,深圳市2025预算.txt
东部,深圳,2024,财政预算报告,physical,保障性住房,全市安排住房保障支出255.2亿元，并积极发挥政府投资、地方债等撬动作用，引入社会资本加快推进保障性住房建设、城中村改造,2552000.0,,深圳市2025预算.txt
东部,深圳,2024,财政预算报告,human,社会保障和就业,全市安排社会保障和就业支出325.1亿元，扩大普惠养老托育服务供给,3251000.0,,深圳市2025预算.txt
东部,深圳,2024,财政预算报告,human,人才,坚持科技是第一生产力、人才是第一资源、创新是第一动力，加强基础研究、应用基础研究和前沿研究，强化企业科技创新主体地位，全市安排科学技术支出364.1亿元，加快建设具有全球重要影响力的产业科技创新中心和粤港澳大湾区高水平人才高地，全方位打造创新之城,3641000.0,,深圳市2025预算.txt
东部,深圳,2024,财政预算报告,physical,未明确方向,市财政安排平台载体经费92.6亿元，加快建设具有全球重要影响力的产业科技创新中心，抢抓《河套深港科技创新合作区深圳园区发展规划》发布的重大战略机遇，出台配套落实文件,926000.0,,深圳市2025预算.txt
东部,深圳,2024,财政预算报告,physical,未明确方向,市财政安排技术攻关经费48.1亿元，围绕“卡脖子”技术清单组织实施科技重大专项，探索实施项目经理人制改革，组织实施原创性引领性科技项目，启动若干项未来技术培育专项,481000.0,,深圳市2025预算.txt
东部,深圳,2024,财政预算报告,physical,未明确方向,市财政安排支持企业创新经费35.5亿元，优化企业研发资助管理方式，支持成长性高新技术企业研发投入，进一步撬动企业R&D投入,355000.0,,深圳市2025预算.txt
东部,深圳,2024,财政预算报告,human,人才,市财政安排人才类经费81.5亿元，推动进一步形成高端科创人才集聚效应和人才国际竞争的比较优势,815000.0,,深圳市2025预算.txt
东部,深圳,2024,财政预算报告,physical,未明确方向,全市安排产业类支出264.6亿元，聚焦“三化三性一力”（具有智能化、绿色化、融合化特征和符合完整性、先进性、安全性要求，具有国际竞争力和深圳特点的现代化产业体系），推进新型工业化，构建优质高效的服务业新体系，培育发展新质生产力，加快发展新业态新模式，加快建设具有深圳特点和优势的现代化产业体系,2646000.0,,深圳市2025预算.txt
东部,深圳,2024,财政预算报告,physical,资源勘探工业信息,全市安排资源勘探工业信息等支出189.0亿元，支持制造业瞄准高端高质高新向上突围，巩固我市工业总产值和增加值“双第一”的领先优势,1890000.0,,深圳市2025预算.txt
东部,深圳,2024,财政预算报告,physical,未明确方向,全市安排商业服务业和金融支出75.6亿元，引导生产性服务业向专业化、高端化延伸，生活性服务业向多样化、高品质升级,756000.0,,深圳市2025预算.txt
东部,深圳,2024,财政预算报告,physical,未明确方向,全市安排节能环保支出172.8亿元，全力支持打造美丽中国深圳样板,1728000.0,,深圳市2025预算.txt
东部,深圳,2024,财政预算报告,physical,交通运输,全市安排交通运输支出176.8亿元，加快建设具有全球重要影响力的物流中心,1768000.0,,深圳市2025预算.txt
东部,深圳,2024,财政预算报告,physical,保障性住房,市财政安排政府投资资金410亿元（含一般债6亿元），全力支持保障性住房建设、“平急两用”公共基础设施建设、城中村改造等“三大工程”，以及关键核心技术攻关、新型基础设施、节能减排降碳等，发挥好政府投资的带动放大效应,4100000.0,,深圳市2025预算.txt
东部,深圳,2024,财政预算报告,physical,未明确方向,全市安排公共安全支出277.4亿元，支持完善公共安全和应急保障体系,2774000.0,,深圳市2025预算.txt
东部,深圳,2024,财政预算报告,physical,未明确方向,按照收支平衡的原则，2024年市本级政府性基金预算支出805.4亿元，加上专项债还本支出和各类转移性支出后，支出总计1500.4亿元,8054000.0,,深圳市2025预算.txt
东部,深圳,2025,财政预算报告,physical,未明确方向,一般公共预算支出4700.9亿元，加上一般债还本支出和各类转,47009000.0,,深圳市2025预算.txt
东部,深圳,2025,财政预算报告,physical,未明确方向,移性支出后，支出总计5573.6亿元，收支平衡,55736000.0,,深圳市2025预算.txt
东部,深圳,2025,财政预算报告,physical,未明确方向,市本级一般公共预算支出2131.7亿元，加上一般,21317000.0,,深圳市2025预算.txt
东部,深圳,2025,财政预算报告,physical,未明确方向,债还本支出和各类转移性支出后，支出总计3479.3亿元，收支,34793000.0,,深圳市2025预算.txt
东部,深圳,2025,财政预算报告,physical,未明确方向,全市政府性基金预算支出1367.7亿元，加上专项债还本,13677000.0,,深圳市2025预算.txt
东部,深圳,2025,财政预算报告,physical,未明确方向,支出和各类转移性支出后，支出总计1787.9亿元，收支平衡,17879000.0,,深圳市2025预算.txt
东部,深圳,2025,财政预算报告,physical,未明确方向,市本级政府性基金预算支出677.6亿元，加上专,6776000.0,,深圳市2025预算.txt
东部,深圳,2025,财政预算报告,physical,未明确方向,项债还本支出和各类转移性支出后，支出总计1602亿元，收支,16020000.0,,深圳市2025预算.txt
东部,深圳,2025,财政预算报告,physical,未明确方向,全市国有资本经营预算支出46.3亿元，加上各类转移性,463000.0,,深圳市2025预算.txt
东部,深圳,2025,财政预算报告,physical,未明确方向,支出后，支出总计86.6亿元，收支平衡,866000.0,,深圳市2025预算.txt
东部,深圳,2025,财政预算报告,physical,未明确方向,市本级国有资本经营预算支出38.3亿元，加上各类转移,383000.0,,深圳市2025预算.txt
东部,深圳,2025,财政预算报告,physical,未明确方向,性支出后，支出总计65.5亿元，收支平衡,655000.0,,深圳市2025预算.txt
东部,深圳,2025,财政预算报告,physical,未明确方向,政部新增下达我市一般债务限额3亿元和专项债务限额213亿元,30000.0,,深圳市2025预算.txt
东部,深圳,2025,财政预算报告,physical,未明确方向,财政部新增下达我市专项债务限额100亿元,1000000.0,,深圳市2025预算.txt
